{
  "schema_version": 1,
  "module": { "id": "oclive.docs-tooling", "kind": "tooling" },
  "provides": ["repository.docs-navigation"],
  "runtime_requires": [],
  "resource_claims": [],
  "declared_affects": [],
  "validation_profiles": ["docs-tooling"],
  "platforms": ["all"],
  "extensions": {}
}
